{
	"name": "Medication Plan",
	"description": "Medication plan defined by gematik (cf. [gemSpec_Info_AMTS] and [https://github.com/gematik/api-telematik/tree/OPB5/fa/amtss/])",
	"igVersion": "3.1.2",
	"guidelineDefinition": {
		"url": "https://fachportal.gematik.de/fileadmin/Fachportal/Downloadcenter/Releases/TI-Baseline/Spezifikationen_Release_TI-Baseline_2022-1.zip",
		"version": "1.6.0"
	},
	"folderCardinality": {
		"min": "1",
		"max": "1",
		"unique": true
	},
	"validFromDate": "2021-06-15",
	"clientReadOnlyFromDate": "2026-12-31",
	"metadata": {
		"name": "folder.codeList",
		"value": {
			"code": "emp",
			"codeSystem": "1.2.276.0.76.5.512",
			"displayName": "Elektronischer Medikationsplan",
			"desc": [
				{
					"language": "de-DE",
					"#text": "Daten des elektronischen Medikationsplans nach § 334 Absatz 1 Satz 2 Nummer 4"
				}
			]
		}
	},
	"elements": [
		{
			"name": "Medication Plan",
			"description": "This document is an XML-based document in UKF-encoding.",
			"metadata": [
				{
					"name": "documentEntry.classCode",
					"value": {
						"code": "PLA",
						"codeSystem": "1.3.6.1.4.1.19376.3.276.1.5.8",
						"displayName": "Planungsdokument",
						"desc": [
							{
								"language": "de-DE",
								"#text": "Dokumente zur Behandlungsplanung (z.B. Bestrahlungsplan, Medikationsplan) oder Versorgungsplanung (z.B. Nachsorge-Plan). Weitere Beispiele: Wiedereingliederungsplan."
							}
						]
					}
				},
				{
					"name": "documentEntry.typeCode",
					"value": {
						"code": "MEDI",
						"codeSystem": "1.3.6.1.4.1.19376.3.276.1.5.9",
						"displayName": "Medikamentöse Therapien",
						"desc": [
							{
								"language": "de-DE",
								"#text": "Therapieprotokolle zum Nachweis der Verabreichung oder Verordnung von Arzneimitteln. Beispiele: Medikamentenplan, Chemotherapieprotokoll, Hormontherapieprotokoll, Apothekenbuch, Rezept, Anforderung Medikation"
							}
						]
					}
				},
				{
					"name": "documentEntry.formatCode",
					"value": {
						"code": "urn:gematik:ig:Medikationsplan:r3.1",
						"codeSystem": "1.3.6.1.4.1.19376.3.276.1.5.6",
						"displayName": "Medikationsplan (gematik)"
					}
				},
				{
					"name": "documentEntry.mimeType",
					"value": [
						"application/xml"
					]
				}
			],
			"documentCardinality": {
				"min": "0",
				"max": "1"
			}
		}
	]
}
