{
	"name": "Dental Records",
	"description": "Dental records defined as a medical information object (MIO) by KBV.",
	"igVersion": "3.0.1",
	"guidelineDefinition": {
		"url": "https://mio.kbv.de/display/ZB1X1X0",
		"version": "1.1.0"
	},
	"folderCardinality": {
		"min": "1",
		"max": "1",
		"unique": true
	},
	"validFromDate": "2021-05-05",
	"clientReadOnlyFromDate": "2027-10-20",
	"type": "uniform",
	"metadata": {
		"name": "folder.codeList",
		"value": {
			"code": "dental",
			"codeSystem": "1.2.276.0.76.5.512",
			"displayName": "Zahnärztliche Dokumentation",
			"desc": [
				{
					"language": "de-DE",
					"#text": "Daten aus der zahnärztlichen Dokumentation"
				}
			]
		}
	},
	"elements": [
		{
			"version": "1.1.0",
			"name": "KBV_PR_MIO_ZAEB_Bundle",
			"description": "This document is a dental record.",
			"canonicalUrl": "https://fhir.kbv.de/StructureDefinition/KBV_PR_MIO_ZAEB_Bundle",
			"metadata": [
				{
					"name": "documentEntry.classCode",
					"value": {
						"code": "AUS",
						"codeSystem": "1.3.6.1.4.1.19376.3.276.1.5.8",
						"displayName": "Medizinischer Ausweis",
						"desc": [
							{
								"language": "de-DE",
								"#text": "Ausweise, Pässe und ähnliche kurze Datensätze, die wichtige medizinische Informationen zusammenfassen. Beispiele: Allergiepass, Allergieausweis, Impfpass, Impfausweis, Impfbuch, Notfalldatensatz"
							}
						]
					}
				},
				{
					"name": "documentEntry.typeCode",
					"value": [
						{
						"code": "PATD",
						"codeSystem": "1.3.6.1.4.1.19376.3.276.1.5.9",
						"displayName": "Patienteneigene Dokumente",
						"deprecatedFrom": "2023-01-01",
						"desc": [
							{
								"language": "de-DE",
								"#text": "Dokumente, welche der Patient zu seinem Kontakt in der Gesundheitseinrichtung mitbringt, die aber nicht in unmittelbarem Zusammenhang mit dem aktuellen Kontakt stehen müssen. Sowie Dokumente, in denen das mitgebrachte Patienteneigentum festgehalten wird. Beispiele: Ausweise, Vorsorgevollmacht, Patientenverfügung, Wertgegenständeverwaltung, Notfalldatensatz, Patiententagebuch"
							}
						]
						},
						{
						"code": "ABRE",
						"codeSystem": "1.3.6.1.4.1.19376.3.276.1.5.9",
						"displayName": "Abrechnungsdokumente",
						"desc": [
							{
								"language": "de-DE",
								"#text": "Administrative Dokumente, die die Abrechnung eines Patientenfalles betreffen. Medizinische Dokumentation, die als Grundlage für die Abrechnung oder als Begründung für die Behandlung herangezogen wird, ist mit dem entsprechenden Konzept abzubilden. Einwilligungen zur Datenweitergabe an Abrechnungsstellen usw. werden mit dem Konzept EINW (\"Einwilligungen/Aufklärungen\") abgebildet. Der nicht abrechnungsbezogene Schriftwechsel mit der Krankenkasse wird mit dem Konzept SCHR (\"Schriftwechsel (administrativ)\") abgebildet. Beispiele: Abrechnungsschein, Rechnung ambulante/stationäre Behandlung, Kostenübernahmeverlängerung"
							}
						]
						}
					]
				},
				{
					"name": "documentEntry.formatCode",
					"value": {
						"code": "urn:gematik:ig:Zahnbonusheft:v1.1.0",
						"codeSystem": "1.3.6.1.4.1.19376.3.276.1.5.6",
						"displayName": "Zahnbonusheft (gematik)"
					}
				},
				{
					"name": "documentEntry.mimeType",
					"value": [
						"application/fhir+xml",
						"application/pkcs7-mime"
					]
				}
			],
			"documentCardinality": {
				"min": "0",
				"max": "n"
			}
		}
	]
}
