{
	"name": "Incapacity to Work Certificate Version 1.1",
	"description": "Nach § 73 Absatz 2 Satz 1 Nummer 9 ausgestellte Bescheinigung über eine Arbeitsunfähigkeit",
	"igVersion": "3.0.1",
	"guidelineDefinition": {
		"url": "https://simplifier.net/packages/kbv.ita.eau/1.1.1/",
		"version": "1.1.1"
	},
	"folderCardinality": {
		"min": "1",
		"max": "1",
		"unique": true
	},
	"validFromDate": "2023-07-01",
	"metadata": {
		"name": "folder.codeList",
		"value": {
			"code": "eau",
			"codeSystem": "1.2.276.0.76.5.512",
			"displayName": "Elektronische Arbeitsunfähigkeitsbescheinigungen",
			"desc": [
				{
					"language": "de-DE",
					"#text": "Nach § 73 Absatz 2 Satz 1 Nummer 9 ausgestellte Bescheinigung über eine Arbeitsunfähigkeit"
				}
			]
		}
	},
	"elements": [
		{
			"name": "Incapacity to Work Certificate",
			"description": "This document is an XML-based document.",
			"metadata": [
				{
					"name": "documentEntry.classCode",
					"value": {
						"code": "ADM",
						"codeSystem": "1.3.6.1.4.1.19376.3.276.1.5.8",
						"displayName": "Administratives Dokument",
						"desc": [
							{
								"language": "de-DE",
								"#text": "Anträge, Aufklärung, Bescheinigungen; auch juristische Dokumente, Vereinbarungen und Verträge; Anmeldungen, Regelungen, Einwilligungen, Bestellungen, Rechnungen, Bescheide, Anordnungen (im juristischen Sinne), Aufträge, Ausweise (außer medizinische Ausweise wie Impfpässe, siehe Konzept AUS (\"Medizinischer Ausweis\")), Meldungen, Qualitätssicherungsdokumente, Patientenverfügungen"
							}
						]
					}
				},
				{
					"name": "documentEntry.typeCode",
					"value": {
						"code": "BESC",
						"codeSystem": "1.3.6.1.4.1.19376.3.276.1.5.9",
						"displayName": "Ärztliche Bescheinigungen",
						"desc": [
							{
								"language": "de-DE",
								"#text": "Bestätigung eines Arztes über einen bestimmten, patientenbezogenen Sachverhalt. Beispiele: Arbeitsunfähigkeitsbescheinigung, Beurlaubung, Todesbescheinigung, Ärztliche Bescheinigung, Notfall-/ Vertretungsschein"
							}
						]
					}
				},
				{
					"name": "documentEntry.formatCode",
					"value": {
						"code": "urn:gematik:ig:Arbeitsunfaehigkeitsbescheinigung:v1.1",
						"codeSystem": "1.3.6.1.4.1.19376.3.276.1.5.6",
						"displayName": "Arbeitsunfähigkeitsbescheinigung (gematik) v1.1"
					}
				},
				{
					"name": "documentEntry.mimeType",
					"value": [
						"application/fhir+xml",
						"application/pkcs7-mime"
					]
				}
			],
			"documentCardinality": {
				"min": "0",
				"max": "n"
			}
		}
	]
}