{
	"name": "Discharge Letter",
	"description": "Discharge Letter defined by KBV acc. to § 383 SGB V",
	"igVersion": "3.0.1",
	"guidelineDefinition": {
		"url": "https://www.kbv.de/media/sp/RL-eArztbrief.pdf"
	},
	"folderCardinality": {
		"min": "1",
		"max": "1",
		"unique": true
	},
	"validFromDate": "2021-06-15",
	"metadata": {
		"name": "folder.codeList",
		"value": {
			"code": "eab",
			"codeSystem": "1.2.276.0.76.5.512",
			"displayName": "eArztbrief",
			"desc": [
				{
					"language": "de-DE",
					"#text": "Daten in elektronischen Briefen zwischen den an der Versorgung der Versicherten teilnehmenden Ärzten und Einrichtungen (elektronische Arztbriefe)"
				}
			]
		}
	},
	"elements": [
		{
			"name": "eArztbrief",
			"description": "This document is a CDA-based discharge letter bundled in an XML container (cf. container definition in PHR_Common.xsd).",
			"canonicalUrl": "https://wiki.hl7.de/index.php?title=IG:Arztbrief_2006",
			"metadata": [
				{
					"name": "documentEntry.classCode",
					"value": {
						"code": "BRI",
						"codeSystem": "1.3.6.1.4.1.19376.3.276.1.5.8",
						"displayName": "Brief",
						"desc": [
							{
								"language": "de-DE",
								"#text": "Alle Varianten von Arztbriefen wie Überweisungsbrief, Entlassbrief, etc. sowie weitere zusammenfassende Dokumente mit einer ärztlichen oder pflegerischen Bewertung der Fakten. Befundberichte werden über das Konzept \"BEF\" (Befundbericht) abgedeckt."
							}
						]
					}
				},
				{
					"name": "documentEntry.typeCode",
					"value": {
						"code": "BERI",
						"codeSystem": "1.3.6.1.4.1.19376.3.276.1.5.9",
						"displayName": "Arztberichte",
						"desc": [
							{
								"language": "de-DE",
								"#text": "Ärztliche Zusammenfassungen und Verlaufsbeurteilungen von Behandlungsepisoden, Epikrisen und Abschlussberichte zu stationären oder ambulanten Behandlungsfällen. Beispiele: Arztbrief, Entlassungsbericht, Ärztliche Stellungnahme, Durchgangsarztbericht / BG-Bericht, Rehabericht, Verlegungsbericht, vorläufiger Arztbericht, ärztlicher Verlaufsbericht, Ambulanzbericht"
							}
						]
					}
				},
				{
					"name": "documentEntry.formatCode",
					"value": {
						"code": "urn:gematik:ig:Arztbrief:r3.1",
						"codeSystem": "1.3.6.1.4.1.19376.3.276.1.5.6",
						"displayName": "Arztbrief § 291f SGB V"
					}
				},
				{
					"name": "documentEntry.eventCodeList",
					"value": {
						"code": "ED110104",
						"codeSystem": "1.2.276.0.76.5.552",
						"displayName": "eArztbrief"
					}
				},				
				{
					"name": "documentEntry.mimeType",
					"value": [
						"application/xml"
					]
				}
			],
			"documentCardinality": {
				"min": "0",
				"max": "n"
			}
		}
	]
}
